{
  "data_cutoff_utc": "2026-10-29T23:59:59Z",
  "data_quality": {
    "definition_rows": 1,
    "duplicate_prediction_dates_ignored": 0,
    "event_rows": 5,
    "first_publications_used": 118,
    "ledger_validation": "passed",
    "outcome_rows": 23,
    "raw_prediction_rows": 118,
    "research_duplicate_dates": 17,
    "research_duplicate_policy": "Eerste gepubliceerde run per datadag.",
    "research_runs_preserved": 132,
    "research_unique_dates": 115,
    "source_sha256": {
      "definitions": "9d70e54dab02ba5dfed07e917e79368a691b713ea365a11229939feb4d867d92",
      "events": "301eea3c45780866090d2b6213f29dbac56fc74aa6e4bdcd0682b30ecc365d93",
      "outcomes": "a43928e79f377b65feed11f7bdbe7ca4b0fc9e4d95c134a0d0cc507a116a6a0a",
      "predictions": "6177787f6ba3adc96e317316f4a82140dfdff92ed48ee90f230833dbbd374e33",
      "research": "267350ad6d896cadd6193d25ac332b3205b0f67b835ed7688035a7bc9100d51b"
    }
  },
  "definition": {
    "candidate_name": "Dichtheid van bevestigde scorepieken",
    "change_policy": "Een wijziging in feature, drempel, horizon, cooldown of controlegroep vereist een nieuwe definition_id en versie; bestaande records worden nooit herschreven.",
    "control_policy": "Alle volwassen officiële dagvensters met minder dan drie bevestigde pieken in dezelfde 10-daagse feature. Overlap wordt expliciet gemeld; inferentie is geclusterd op onafhankelijke events.",
    "cooldown_days": 10,
    "definition_id": "peak-density-v1",
    "discovery_note": "De kandidaat is na inspectie van historische patronen gekozen. De bestaande uitkomsten zijn daarom uitsluitend verkennend en tellen niet als bevestiging.",
    "discovery_period": {
      "classification": "retrospective_exploratory",
      "from": "2026-07-04",
      "through": "2026-10-24"
    },
    "economic_relevance_threshold": {
      "note": "Apart van statistische bevestiging beoordeeld.",
      "sol_uplift_7d_percentage_points": 2.0
    },
    "event_rule": "Start een event wanneer het aantal bevestigde pieken in de laatste tien officiële signalen van minder dan drie naar ten minste drie gaat.",
    "feature": {
      "name": "confirmed_peak_count_10d",
      "operator": ">=",
      "threshold": 3,
      "window_observations": 10
    },
    "input_policy": "Alleen de eerste officiële prediction per data_cutoff-dag.",
    "locked_at_utc": "2026-10-26T10:55:00Z",
    "payload_sha256": "cee9b7192e1dc0d1618a92f26b88585a99482de7a9f838ab008e53032db1c451",
    "peak_rule": "Op dag t wordt t-1 als piek bevestigd wanneer score[t-1] > score[t-2] en score[t-1] >= score[t].",
    "primary_horizon_days": 7,
    "prospective_policy": "Een event is prospectief wanneer de eerste officiële publicatie op of na 2026-10-26T10:55:00Z plaatsvindt. Historische backfill blijft altijd retrospectief.",
    "secondary_horizons_days": [
      1,
      3,
      14,
      30
    ],
    "status": "locked",
    "version": "1.0.0"
  },
  "downloads": [
    {
      "label": "Signaaldefinities (JSONL)",
      "path": "./data/signal_definitions.jsonl"
    },
    {
      "label": "Events (JSONL)",
      "path": "./data/signal_events.jsonl"
    },
    {
      "label": "Uitkomsten (JSONL)",
      "path": "./data/signal_outcomes.jsonl"
    },
    {
      "label": "Monitor (JSON)",
      "path": "./data/predictive_monitor.json"
    }
  ],
  "event_study": [
    {
      "btc_relative_mean_return": 0.0001831351,
      "event_n": 5,
      "offset_days": -5,
      "sol_mean_return": -0.0063810926
    },
    {
      "btc_relative_mean_return": -0.0007879663,
      "event_n": 5,
      "offset_days": -4,
      "sol_mean_return": -0.0093618171
    },
    {
      "btc_relative_mean_return": -0.003420144,
      "event_n": 5,
      "offset_days": -3,
      "sol_mean_return": -0.0126041786
    },
    {
      "btc_relative_mean_return": -0.0044566533,
      "event_n": 5,
      "offset_days": -2,
      "sol_mean_return": -0.0062308019
    },
    {
      "btc_relative_mean_return": 0.0049929303,
      "event_n": 5,
      "offset_days": -1,
      "sol_mean_return": 0.0070644777
    },
    {
      "btc_relative_mean_return": 0.0,
      "event_n": 5,
      "offset_days": 0,
      "sol_mean_return": 0.0
    },
    {
      "btc_relative_mean_return": 0.0006010786,
      "event_n": 5,
      "offset_days": 1,
      "sol_mean_return": 0.0010427625
    },
    {
      "btc_relative_mean_return": 0.0074996958,
      "event_n": 5,
      "offset_days": 2,
      "sol_mean_return": 0.0096585406
    },
    {
      "btc_relative_mean_return": -0.002318549,
      "event_n": 5,
      "offset_days": 3,
      "sol_mean_return": -0.0103783309
    },
    {
      "btc_relative_mean_return": 0.0025588335,
      "event_n": 5,
      "offset_days": 4,
      "sol_mean_return": -0.0031414409
    },
    {
      "btc_relative_mean_return": 0.014638035,
      "event_n": 5,
      "offset_days": 5,
      "sol_mean_return": 0.0241436656
    },
    {
      "btc_relative_mean_return": 0.0175300357,
      "event_n": 5,
      "offset_days": 6,
      "sol_mean_return": 0.0441289386
    },
    {
      "btc_relative_mean_return": 0.0086611752,
      "event_n": 5,
      "offset_days": 7,
      "sol_mean_return": 0.0532546576
    },
    {
      "btc_relative_mean_return": 0.0092742626,
      "event_n": 5,
      "offset_days": 8,
      "sol_mean_return": 0.0547943497
    },
    {
      "btc_relative_mean_return": 0.0145279096,
      "event_n": 5,
      "offset_days": 9,
      "sol_mean_return": 0.0789796447
    },
    {
      "btc_relative_mean_return": 0.0181869755,
      "event_n": 5,
      "offset_days": 10,
      "sol_mean_return": 0.0719819291
    },
    {
      "btc_relative_mean_return": 0.0205667302,
      "event_n": 4,
      "offset_days": 11,
      "sol_mean_return": 0.0975937771
    },
    {
      "btc_relative_mean_return": 0.0448598083,
      "event_n": 4,
      "offset_days": 12,
      "sol_mean_return": 0.1243133232
    },
    {
      "btc_relative_mean_return": 0.0773162946,
      "event_n": 4,
      "offset_days": 13,
      "sol_mean_return": 0.1600392223
    },
    {
      "btc_relative_mean_return": 0.0629343991,
      "event_n": 4,
      "offset_days": 14,
      "sol_mean_return": 0.13257177
    }
  ],
  "events": [
    {
      "btc_entry_price": 81837.69,
      "btc_relative_return_7d": -0.0176673502,
      "definition_version": "1.0.0",
      "evaluation_phase": "retrospective",
      "event_date": "2026-10-19",
      "event_id": "peak-density-v1__2026-10-19",
      "event_payload_sha256": "5e63fea1e78cc241e1b52d467b413b056b4ec9094c851628cdfc36b9e43ed294",
      "feature_value": 3,
      "first_published_at_utc": "2026-10-20T13:25:43Z",
      "outcome_payload_sha256": "30f3d5a3120e18583ac7466ea23248d39a79aa10a08d26a695917380cf83efd1",
      "primary_maturity_date": "2026-10-26",
      "sol_entry_price": 104.96,
      "sol_return_14d": null,
      "sol_return_7d": -0.0400152439,
      "status": "matured"
    },
    {
      "btc_entry_price": 84378.31,
      "btc_relative_return_7d": 0.0364418285,
      "definition_version": "1.0.0",
      "evaluation_phase": "retrospective",
      "event_date": "2026-09-23",
      "event_id": "peak-density-v1__2026-09-23",
      "event_payload_sha256": "4c94e8e3c0df2c093af963e6bdeacfd2ca2c5d6115c4a1fc5d338252fd2d807d",
      "feature_value": 3,
      "first_published_at_utc": "2026-09-24T13:22:55Z",
      "outcome_payload_sha256": "e23f90865b0b73589bcc0dd27b6c83f05bf6fef5c05cc730948743cb2af9a1c8",
      "primary_maturity_date": "2026-09-30",
      "sol_entry_price": 114.99,
      "sol_return_14d": 0.0109574746,
      "sol_return_7d": 0.0266979737,
      "status": "matured"
    },
    {
      "btc_entry_price": 77272.9,
      "btc_relative_return_7d": 0.0398644281,
      "definition_version": "1.0.0",
      "evaluation_phase": "retrospective",
      "event_date": "2026-09-12",
      "event_id": "peak-density-v1__2026-09-12",
      "event_payload_sha256": "cf6747ab7a39fc127cde2b3869d0892d0dd47b4f8269686d1ae77ca3e611e95c",
      "feature_value": 3,
      "first_published_at_utc": "2026-09-13T09:34:35Z",
      "outcome_payload_sha256": "124ad0cf3aeb93ea816b7a0438ecec943feaa4887b91e18f85e1695efd9d5650",
      "primary_maturity_date": "2026-09-19",
      "sol_entry_price": 101.755,
      "sol_return_14d": 0.1929634907,
      "sol_return_7d": 0.0912977249,
      "status": "matured"
    },
    {
      "btc_entry_price": 62975.19,
      "btc_relative_return_7d": 0.0003735051,
      "definition_version": "1.0.0",
      "evaluation_phase": "retrospective",
      "event_date": "2026-08-14",
      "event_id": "peak-density-v1__2026-08-14",
      "event_payload_sha256": "03fefa0681950d6895f0c77a513bc5434513cbb6ea835b8a5f52f887f0010232",
      "feature_value": 3,
      "first_published_at_utc": "2026-08-15T08:32:51Z",
      "outcome_payload_sha256": "b07cb14e458497b28e499e47a1c9314b994e1c85f9f85e16b043f64327db6db5",
      "primary_maturity_date": "2026-08-21",
      "sol_entry_price": 75.33,
      "sol_return_14d": 0.3825833001,
      "sol_return_7d": 0.2441258463,
      "status": "matured"
    },
    {
      "btc_entry_price": 66516.18,
      "btc_relative_return_7d": -0.0157065357,
      "definition_version": "1.0.0",
      "evaluation_phase": "retrospective",
      "event_date": "2026-07-21",
      "event_id": "peak-density-v1__2026-07-21",
      "event_payload_sha256": "36fe6c7aa359b233a963974ee4e7f1c2006ac4de079c2f03c8b9112435b03848",
      "feature_value": 3,
      "first_published_at_utc": "2026-07-22T10:29:16Z",
      "outcome_payload_sha256": "fe1578b38833bf7fe47a18573213e1461bf8a3455948eacf883a85d0e370ce5b",
      "primary_maturity_date": "2026-07-28",
      "sol_entry_price": 78.09,
      "sol_return_14d": -0.0562171853,
      "sol_return_7d": -0.0558330132,
      "status": "matured"
    }
  ],
  "evidence_over_time": [
    {
      "ci95_high": -0.0475402503,
      "ci95_low": -0.0612594575,
      "control_n": 8,
      "estimate": -0.0543998539,
      "event_n": 1,